{
  "candidate_path": "solution.js",
  "family": "javascript_typescript",
  "files": [
    {
      "content": "const{parseNetstring:f}=require('./solution');for(const[a,b]of[['5:hello,','hello'],['0:,',''],['3:a:b,','a:b']])if(f(a)!==b)throw Error(a);for(const x of ['05:hello,','5:hell,','5:hello,x','1:\\n,','x:a,'])if(f(x)!==null)throw Error(x);\n",
      "path": "solution.test.js",
      "role": "test",
      "sha256": "f2f21cd85c29673b3bb7dfbcc2de75f143f7dc55505d3524895449ecf85e58b0"
    }
  ],
  "language": "javascript",
  "limits": {
    "cpus": 1,
    "memory_mb": 512,
    "output_bytes": 65536,
    "pids": 64,
    "timeout_seconds": 30
  },
  "prompt": {
    "sha256": "4779ef3aaae1740989a6026d780a2be4b4291b30e99a81faee16415b461339e4",
    "text": "Implement the following API.\n\nFile contract: Return CommonJS module solution.js.\nRequired API: exports.parseNetstring = function(text), returning a string or null\nBehavior: Parse exactly one ASCII netstring length:payload,. The length is decimal bytes with no sign and no leading zero except the single digit 0; payload must be printable ASCII, its byte length must match, and no trailing data is allowed.\nVisible example: \"5:hello,\" produces \"hello\", while \"05:hello,\" fails.\n\nReturn only the complete source file; do not include Markdown fences or prose."
  },
  "rendered_prompt": {
    "sha256": "4779ef3aaae1740989a6026d780a2be4b4291b30e99a81faee16415b461339e4",
    "text": "Implement the following API.\n\nFile contract: Return CommonJS module solution.js.\nRequired API: exports.parseNetstring = function(text), returning a string or null\nBehavior: Parse exactly one ASCII netstring length:payload,. The length is decimal bytes with no sign and no leading zero except the single digit 0; payload must be printable ASCII, its byte length must match, and no trailing data is allowed.\nVisible example: \"5:hello,\" produces \"hello\", while \"05:hello,\" fails.\n\nReturn only the complete source file; do not include Markdown fences or prose."
  },
  "runtime_id": "javascript-node-22.23.2",
  "schema_version": "1.0",
  "surface": "development",
  "task_id": "dev-t2-javascript-parse-netstring",
  "task_type": "generation",
  "validation": {
    "known_bad": [
      {
        "code": "exports.parseNetstring=function(s){const c=s.indexOf(':');if(c<0)return null;const n=parseInt(s);return s.slice(c+1,c+1+n)}\n",
        "label": "ignores-framing-contract",
        "sha256": "446985613a331fe300797c2ea49ab784e8a2527d356e56938bea53ffb1493636"
      }
    ],
    "reference": {
      "code": "exports.parseNetstring=function(s){const m=/^(0|[1-9][0-9]*):/.exec(s);if(!m)return null;const n=Number(m[1]),a=m[0].length;if(!Number.isSafeInteger(n)||a+n+1!==s.length||s[a+n]!==',')return null;const p=s.slice(a,a+n);for(const c of p)if(c.charCodeAt(0)<32||c.charCodeAt(0)>126)return null;return p}\n",
      "label": "author-reference",
      "sha256": "de0d285ee9785bd9392187ab96369fe4d5b87defb5873e2f8f2c118b2ee6330b"
    }
  }
}
