{
  "candidate_path": "solution.py",
  "family": "python",
  "files": [
    {
      "content": "from solution import first_min_per_key\nassert first_min_per_key(['b','a','b','a','c'],[5,4,3,3,9])==[2,3,4]\nassert first_min_per_key(['x','x'],[1,1])==[0]\nassert first_min_per_key(['x'],[]) is None\n",
      "path": "test_solution.py",
      "role": "test",
      "sha256": "173191e3d283766d02977bf63c982ae635b9040f58ebb13b22189347982c5f64"
    }
  ],
  "language": "python",
  "limits": {
    "cpus": 1,
    "memory_mb": 512,
    "output_bytes": 65536,
    "pids": 64,
    "timeout_seconds": 30
  },
  "prompt": {
    "sha256": "3e85da400275ebbf0241ace092dcf7e887ad53bc810ec39bee9550615037a7b4",
    "text": "Implement the following API.\n\nFile contract: Write solution.py with the function at module scope.\nRequired API: def first_min_per_key(keys: list[str], scores: list[int]) -> list[int] | None\nBehavior: Reject unequal key and score lengths. For each exact key choose the index with the smallest score, breaking ties by earliest index. Return chosen indices in order of each key's first appearance; empty inputs succeed with a non-null empty result.\nVisible example: For keys [\"b\",\"a\",\"b\",\"a\"] and scores [5,4,3,3], return [2,3].\n\nReturn only the complete source file; do not include Markdown fences or prose."
  },
  "rendered_prompt": {
    "sha256": "3e85da400275ebbf0241ace092dcf7e887ad53bc810ec39bee9550615037a7b4",
    "text": "Implement the following API.\n\nFile contract: Write solution.py with the function at module scope.\nRequired API: def first_min_per_key(keys: list[str], scores: list[int]) -> list[int] | None\nBehavior: Reject unequal key and score lengths. For each exact key choose the index with the smallest score, breaking ties by earliest index. Return chosen indices in order of each key's first appearance; empty inputs succeed with a non-null empty result.\nVisible example: For keys [\"b\",\"a\",\"b\",\"a\"] and scores [5,4,3,3], return [2,3].\n\nReturn only the complete source file; do not include Markdown fences or prose."
  },
  "runtime_id": "python-3.11.15",
  "schema_version": "1.0",
  "surface": "development",
  "task_id": "dev-t3-python-first-min-per-key",
  "task_type": "generation",
  "validation": {
    "known_bad": [
      {
        "code": "def first_min_per_key(keys: list[str], scores: list[int]) -> list[int] | None:\n    if len(keys)!=len(scores): return None\n    return list({key:i for i,key in enumerate(keys)}.values())\n",
        "label": "last-index-selection",
        "sha256": "8f5585ea5f2d88796944a2477c78798ce0b22addc74e8ab1db85b1ac74476838"
      }
    ],
    "reference": {
      "code": "def first_min_per_key(keys: list[str], scores: list[int]) -> list[int] | None:\n    if len(keys)!=len(scores): return None\n    order=[];best={}\n    for i,key in enumerate(keys):\n        if key not in best: order.append(key);best[key]=i\n        elif scores[i] < scores[best[key]]: best[key]=i\n    return [best[key] for key in order]\n",
      "label": "author-reference",
      "sha256": "99737c0e5bee8fa25eca13d3be49c05771b5042401caf2f5237727244894f162"
    }
  }
}
