{
  "candidate_path": "solution.js",
  "family": "javascript_typescript",
  "files": [
    {
      "content": "const {dependenciesValid:f}=require('./solution');if(!f(['parse','build','ship'],[['parse','build'],['build','ship']])||f(['a','b'],[['a','b'],['b','a']])||f(['a','a'],[])||f(['a'],[['a','x']]))throw Error('deps');\n",
      "path": "solution.test.js",
      "role": "test",
      "sha256": "386dbdb8f9f99e1f18e603cfe9795a96fd093e264c56c26ec3d16f769174122e"
    }
  ],
  "language": "javascript",
  "limits": {
    "cpus": 1,
    "memory_mb": 512,
    "output_bytes": 65536,
    "pids": 64,
    "timeout_seconds": 30
  },
  "prompt": {
    "sha256": "eba03eedb8b3361edc85513eca23dce20ad3a7ce22a982bb25cf1da37e180e68",
    "text": "Implement the following API.\n\nFile contract: Return CommonJS module solution.js.\nRequired API: exports.dependenciesValid = function(nodes, edges)\nBehavior: Return true exactly when node names are unique, every directed edge endpoint is declared, and the directed dependency graph is acyclic. Empty input is valid.\nVisible example: nodes [parse, build, ship] with parse->build and build->ship is valid; adding ship->parse makes it invalid.\n\nReturn only the complete source file; do not include Markdown fences or prose."
  },
  "rendered_prompt": {
    "sha256": "eba03eedb8b3361edc85513eca23dce20ad3a7ce22a982bb25cf1da37e180e68",
    "text": "Implement the following API.\n\nFile contract: Return CommonJS module solution.js.\nRequired API: exports.dependenciesValid = function(nodes, edges)\nBehavior: Return true exactly when node names are unique, every directed edge endpoint is declared, and the directed dependency graph is acyclic. Empty input is valid.\nVisible example: nodes [parse, build, ship] with parse->build and build->ship is valid; adding ship->parse makes it invalid.\n\nReturn only the complete source file; do not include Markdown fences or prose."
  },
  "runtime_id": "javascript-node-22.23.2",
  "schema_version": "1.0",
  "surface": "development",
  "task_id": "dev-t4-javascript-dependency-cycle",
  "task_type": "generation",
  "validation": {
    "known_bad": [
      {
        "code": "exports.dependenciesValid=(n,e)=>{const k=new Set(n);return e.every(([a,b])=>k.has(a)&&k.has(b))}\n",
        "label": "does-not-detect-cycles-or-duplicates",
        "sha256": "e14da9443f5a8093bddae6679a4f16b2c5f728707da402ebffcff43e7ab072dc"
      }
    ],
    "reference": {
      "code": "exports.dependenciesValid=(n,e)=>{const d=new Map;for(const x of n){if(d.has(x))return false;d.set(x,0)}const g=new Map;for(const [a,b]of e){if(!d.has(a)||!d.has(b))return false;(g.get(a)||g.set(a,[]).get(a)).push(b);d.set(b,d.get(b)+1)}const q=[...d].filter(x=>x[1]===0).map(x=>x[0]);let seen=0;while(q.length){const x=q.pop();seen++;for(const y of g.get(x)||[]){d.set(y,d.get(y)-1);if(d.get(y)===0)q.push(y)}}return seen===n.length}\n",
      "label": "author-reference",
      "sha256": "094028f4519e8cc626d4600564e66011e517ca9ade36ee925ffd9a2341a71bd5"
    }
  }
}
