{
  "candidate_path": "solution.rs",
  "family": "rust",
  "files": [
    {
      "content": "mod solution;use solution::*;#[test]fn contract(){assert_eq!(triple_window_sums(\"1,2,3,4\"),Some(\"6,9\".into()));assert_eq!(triple_window_sums(\"1,2\"),Some(\"\".into()));assert_eq!(triple_window_sums(\"-1000,0,1000\"),Some(\"0\".into()));assert!(triple_window_sums(\"1,+2,3\").is_none());assert!(triple_window_sums(\"1,,3\").is_none());}\n",
      "path": "solution_test.rs",
      "role": "test",
      "sha256": "73cd4cbdb3f312a4f36824d61dd19834f5c2e0914f0f8dc524fb31ef6ff54bff"
    }
  ],
  "language": "rust",
  "limits": {
    "cpus": 1,
    "memory_mb": 512,
    "output_bytes": 65536,
    "pids": 64,
    "timeout_seconds": 60
  },
  "prompt": {
    "sha256": "86ab4c771548d452e14725bc773f9c5a46241aca3aeba9b371e7aba7fc64136a",
    "text": "Repair the buggy source below without changing the required API.\n\nFile contract: Return solution.rs with the public function at module scope.\nRequired API: pub fn triple_window_sums(input: &str) -> Option<String>\nBehavior: Parse a non-empty comma-separated list of canonical signed decimal integers in -1000..1000. Return sums of every consecutive three-value window in left-to-right order, joined by commas; fewer than three values returns the empty string. Reject malformed or out-of-range input.\nVisible example: 1,2,3,4 returns 6,9.\n\nBuggy source to repair:\n\npub fn triple_window_sums(input:&str)->Option<String>{Some(input.to_string())}\n\nReturn only the complete source file; do not include Markdown fences or prose."
  },
  "rendered_prompt": {
    "sha256": "86ab4c771548d452e14725bc773f9c5a46241aca3aeba9b371e7aba7fc64136a",
    "text": "Repair the buggy source below without changing the required API.\n\nFile contract: Return solution.rs with the public function at module scope.\nRequired API: pub fn triple_window_sums(input: &str) -> Option<String>\nBehavior: Parse a non-empty comma-separated list of canonical signed decimal integers in -1000..1000. Return sums of every consecutive three-value window in left-to-right order, joined by commas; fewer than three values returns the empty string. Reject malformed or out-of-range input.\nVisible example: 1,2,3,4 returns 6,9.\n\nBuggy source to repair:\n\npub fn triple_window_sums(input:&str)->Option<String>{Some(input.to_string())}\n\nReturn only the complete source file; do not include Markdown fences or prose."
  },
  "runtime_id": "rust-1.85.0",
  "schema_version": "1.0",
  "surface": "decision",
  "task_id": "decision-t5-rust-triple-window-sums",
  "task_type": "repair",
  "validation": {
    "known_bad": [
      {
        "code": "pub fn triple_window_sums(input:&str)->Option<String>{Some(input.to_string())}\n",
        "label": "identity-instead-of-contract",
        "sha256": "43f5b2dafee7d2fdfb2291c6f5bb18b4b346a343c30d79d081c210e5e8b3054b"
      }
    ],
    "reference": {
      "code": "fn nums(s:&str)->Option<Vec<i32>>{if s.is_empty(){return None}let mut o=vec![];for z in s.split(','){let x:i32=z.parse().ok()?;if x.to_string()!=z||x< -1000||x>1000{return None}o.push(x)}Some(o)}fn join(a:&[i32])->String{a.iter().map(|x|x.to_string()).collect::<Vec<_>>().join(\",\")}pub fn triple_window_sums(s:&str)->Option<String>{let a=nums(s)?;Some(a.windows(3).map(|x|(x[0]+x[1]+x[2]).to_string()).collect::<Vec<_>>().join(\",\"))}\n",
      "label": "author-reference",
      "sha256": "f59f3e7303c6c8301b0a91403dd12081e923513650206173b5a1f7dff7533625"
    }
  }
}
