{
  "candidate_path": "Solution.java",
  "family": "java",
  "files": [
    {
      "content": "import java.util.*;public final class SolutionTest{public static void main(String[]z){var first=new int[]{9,1,10,0,1};var in=new ArrayList<int[]>(List.of(first,new int[]{4,1,2,0,5},new int[]{3,1,2,0,1},new int[]{2,1,2,0,1}));assert Solution.orderChanges(in).equals(List.of(2,3,4,9))&&in.get(0)==first;assert Solution.orderChanges(List.of(new int[]{1,1,0,0,0},new int[]{1,2,0,0,0}))==null;assert Solution.orderChanges(List.of(new int[]{1,-1,0,0,0}))==null;}}\n",
      "path": "SolutionTest.java",
      "role": "test",
      "sha256": "b259005680db1953f061ac7573732c9716b546e5e68bdc719d470c555f96db25"
    }
  ],
  "language": "java",
  "limits": {
    "cpus": 1,
    "memory_mb": 512,
    "output_bytes": 65536,
    "pids": 64,
    "timeout_seconds": 30
  },
  "prompt": {
    "sha256": "b192331b881d0a90db344116bca6ceab540dc07dc3801c591449a0c39e2a0fa2",
    "text": "Repair the buggy source below without changing the required API.\n\nFile contract: Return Solution.java defining public final class Solution.\nRequired API: public static List<Integer> orderChanges(List<int[]> changes)\nBehavior: Each change is (id,major,minor,patch,sequence). Reject duplicate ids or negative version/sequence fields. Without mutating input, return ids ordered by numeric major, minor, patch, sequence, then id.\nVisible example: changes ids 9 at 1.10.0/1 and 4 at 1.2.0/5 order as [4,9], using numeric versions.\n\nBuggy source to repair:\n\nimport java.util.*;public final class Solution{public static List<Integer> orderChanges(List<int[]>v){v.sort(Comparator.comparingInt(x->x[4]));var o=new ArrayList<Integer>();for(var x:v)o.add(x[0]);return o;}}\n\nReturn only the complete source file; do not include Markdown fences or prose."
  },
  "rendered_prompt": {
    "sha256": "b192331b881d0a90db344116bca6ceab540dc07dc3801c591449a0c39e2a0fa2",
    "text": "Repair the buggy source below without changing the required API.\n\nFile contract: Return Solution.java defining public final class Solution.\nRequired API: public static List<Integer> orderChanges(List<int[]> changes)\nBehavior: Each change is (id,major,minor,patch,sequence). Reject duplicate ids or negative version/sequence fields. Without mutating input, return ids ordered by numeric major, minor, patch, sequence, then id.\nVisible example: changes ids 9 at 1.10.0/1 and 4 at 1.2.0/5 order as [4,9], using numeric versions.\n\nBuggy source to repair:\n\nimport java.util.*;public final class Solution{public static List<Integer> orderChanges(List<int[]>v){v.sort(Comparator.comparingInt(x->x[4]));var o=new ArrayList<Integer>();for(var x:v)o.add(x[0]);return o;}}\n\nReturn only the complete source file; do not include Markdown fences or prose."
  },
  "runtime_id": "java-21.0.11",
  "schema_version": "1.0",
  "surface": "development",
  "task_id": "dev-t6-java-version-change-order",
  "task_type": "repair",
  "validation": {
    "known_bad": [
      {
        "code": "import java.util.*;public final class Solution{public static List<Integer> orderChanges(List<int[]>v){v.sort(Comparator.comparingInt(x->x[4]));var o=new ArrayList<Integer>();for(var x:v)o.add(x[0]);return o;}}\n",
        "label": "orders-by-sequence-only-and-mutates",
        "sha256": "cad6b12549bc932d738d81d146f0718ddafbf15d7e339a6607ae42efb18b333a"
      }
    ],
    "reference": {
      "code": "import java.util.*;public final class Solution{public static List<Integer> orderChanges(List<int[]>v){var a=new ArrayList<int[]>();var seen=new HashSet<Integer>();for(var x:v){if(x.length!=5||!seen.add(x[0])||x[1]<0||x[2]<0||x[3]<0||x[4]<0)return null;a.add(x.clone());}a.sort((x,y)->{for(int k:new int[]{1,2,3,4,0}){int c=Integer.compare(x[k],y[k]);if(c!=0)return c;}return 0;});var o=new ArrayList<Integer>();for(var x:a)o.add(x[0]);return o;}}\n",
      "label": "author-reference",
      "sha256": "3e022e60f34613e0e0adedbee25cefc9437394b1a6d15f7e18648700bc5988fe"
    }
  }
}
