{
  "candidate_path": "Solution.java",
  "family": "java",
  "files": [
    {
      "content": "import java.util.*;public final class SolutionTest{public static void main(String[]z){if(!(Solution.orderChanges(List.<String[]>of(new String[]{\"a\",\"-\",\"2\"},new String[]{\"b\",\"a\",\"0\"},new String[]{\"c\",\"-\",\"1\"})).equals(List.of(\"c\",\"a\",\"b\"))&&Solution.orderChanges(List.<String[]>of(new String[]{\"a\",\"-\",\"0\"},new String[]{\"a\",\"-\",\"1\"}))==null&&Solution.orderChanges(List.<String[]>of(new String[]{\"a\",\"x\",\"0\"}))==null&&Solution.orderChanges(List.<String[]>of(new String[]{\"a\",\"a\",\"0\"}))==null&&Solution.orderChanges(List.<String[]>of(new String[]{\"a\",\"b\",\"0\"},new String[]{\"b\",\"a\",\"0\"}))==null&&Solution.orderChanges(List.<String[]>of(new String[]{\"a\",\"-\",\"-1\"}))==null&&Solution.orderChanges(List.<String[]>of(new String[]{\"__proto__\",\"-\",\"0\"}))==null&&Solution.orderChanges(List.<String[]>of(new String[]{\"a\",\"-\"}))==null))throw new AssertionError();}}\n",
      "path": "SolutionTest.java",
      "role": "test",
      "sha256": "ee6b67dfda65d86c746f29996f4ccd88a88aee4f79f22aae4aab84e2bfa90011"
    }
  ],
  "language": "java",
  "limits": {
    "cpus": 1,
    "memory_mb": 512,
    "output_bytes": 65536,
    "pids": 64,
    "timeout_seconds": 60
  },
  "prompt": {
    "sha256": "fd8e4f6837fe66a47c4bb448fe80fafd7352b48c63efdcd359f629f0328acddf",
    "text": "Repair the buggy source below without changing the required API.\n\nFile contract: Return Solution.java defining public final class Solution.\nRequired API: public static List<String> orderChanges(List<String[]> changes)\nBehavior: Each change is id,parentId,sequence; '-' means no parent. IDs match ASCII [a-z][a-z0-9]*(?:-[a-z0-9]+)* and sequence is an integer in 0..10,000,000. Reject duplicates, unknown/self/cyclic parents. Return dependency-safe order, choosing smallest sequence then Unicode code-point id among ready changes.\nVisible example: a,-,2; b,a,0; c,-,1 returns [c,a,b].\n\nBuggy source to repair:\n\nimport java.util.*;public final class Solution{public static List<String> orderChanges(List<String[]> changes){return null;}}\n\nReturn only the complete source file; do not include Markdown fences or prose."
  },
  "rendered_prompt": {
    "sha256": "fd8e4f6837fe66a47c4bb448fe80fafd7352b48c63efdcd359f629f0328acddf",
    "text": "Repair the buggy source below without changing the required API.\n\nFile contract: Return Solution.java defining public final class Solution.\nRequired API: public static List<String> orderChanges(List<String[]> changes)\nBehavior: Each change is id,parentId,sequence; '-' means no parent. IDs match ASCII [a-z][a-z0-9]*(?:-[a-z0-9]+)* and sequence is an integer in 0..10,000,000. Reject duplicates, unknown/self/cyclic parents. Return dependency-safe order, choosing smallest sequence then Unicode code-point id among ready changes.\nVisible example: a,-,2; b,a,0; c,-,1 returns [c,a,b].\n\nBuggy source to repair:\n\nimport java.util.*;public final class Solution{public static List<String> orderChanges(List<String[]> changes){return null;}}\n\nReturn only the complete source file; do not include Markdown fences or prose."
  },
  "runtime_id": "java-21.0.11",
  "schema_version": "1.0",
  "surface": "decision",
  "task_id": "decision-t2-java-change-order",
  "task_type": "repair",
  "validation": {
    "known_bad": [
      {
        "code": "import java.util.*;public final class Solution{public static List<String> orderChanges(List<String[]> changes){return null;}}\n",
        "label": "returns-default-instead-of-contract",
        "sha256": "5ed2d9a1546e7b0488259e72bfc73e40711d102f6b049ca6bd856fcc629644c8"
      }
    ],
    "reference": {
      "code": "import java.util.*;public final class Solution{public static List<String> orderChanges(List<String[]>a){record V(String p,int q){}var d=new HashMap<String,V>();String k=\"[a-z][a-z0-9]*(?:-[a-z0-9]+)*\";for(var x:a){if(x.length!=3||!x[0].matches(k)||(!x[1].equals(\"-\")&&!x[1].matches(k))||x[0].equals(x[1]))return null;int q;try{q=Integer.parseInt(x[2]);}catch(Exception z){return null;}if(q<0||q>10000000||!Integer.toString(q).equals(x[2])||d.putIfAbsent(x[0],new V(x[1],q))!=null)return null;}for(var x:d.values())if(!x.p.equals(\"-\")&&!d.containsKey(x.p))return null;var o=new ArrayList<String>();var z=new HashSet<String>();while(o.size()<d.size()){var r=d.keySet().stream().filter(n->!z.contains(n)&&(d.get(n).p.equals(\"-\")||z.contains(d.get(n).p))).sorted(Comparator.comparingInt((String n)->d.get(n).q).thenComparing(n->n)).toList();if(r.isEmpty())return null;z.add(r.get(0));o.add(r.get(0));}return o;}}\n",
      "label": "author-reference",
      "sha256": "1e00cd2e48043bbdd229f18ee5e5e896a15854027c4570edc79fd3d88c0c1bee"
    }
  }
}
