{
  "candidate_path": "solution.rs",
  "family": "rust",
  "files": [
    {
      "content": "mod solution{include!(\"solution.rs\");}use solution::*;#[test]fn cases(){assert_eq!(parse_quoted_list(\"\"),Some(vec![]));assert_eq!(parse_quoted_list(\"\\\"a\\\",\\\"b\\\"\\\"c\\\",\\\"\\\"\"),Some(vec![\"a\".into(),\"b\\\"c\".into(),\"\".into()]));assert_eq!(parse_quoted_list(\"\\\"a,b\\\"\"),Some(vec![\"a,b\".into()]));for x in [\"a\",\" \\\"a\\\"\",\"\\\"a\\\"x\",\"\\\"a\",\"\\\"a\\\",\"]{assert_eq!(parse_quoted_list(x),None)}}\n",
      "path": "solution_test.rs",
      "role": "test",
      "sha256": "bed10aea258dcc6c0bac86bea7bccd517364ba4995c9375b49de35e578140d8a"
    }
  ],
  "language": "rust",
  "limits": {
    "cpus": 1,
    "memory_mb": 512,
    "output_bytes": 65536,
    "pids": 64,
    "timeout_seconds": 30
  },
  "prompt": {
    "sha256": "65ffb132887e888a14b1c715960301d3eac75321fc9dcbd5e0f07c791251e2dc",
    "text": "Repair the buggy source below without changing the required API.\n\nFile contract: Return solution.rs using only the standard library.\nRequired API: pub fn parse_quoted_list(text: &str) -> Option<Vec<String>>\nBehavior: Parse a comma-separated list in which every field is double-quoted and an embedded double quote is represented by two consecutive quotes. Preserve empty fields; reject unquoted text, whitespace outside quotes, malformed quoting, or trailing data. Empty input represents an empty list.\nVisible example: The text \"a\",\"b\"\"c\",\"\" produces [\"a\", \"b\\\"c\", \"\"].\n\nBuggy source to repair:\n\npub fn parse_quoted_list(s:&str)->Option<Vec<String>>{if s.is_empty(){return Some(vec![])}Some(s.split(',').map(|x|x.trim().replace('\"',\"\")).collect())}\n\nReturn only the complete source file; do not include Markdown fences or prose."
  },
  "rendered_prompt": {
    "sha256": "65ffb132887e888a14b1c715960301d3eac75321fc9dcbd5e0f07c791251e2dc",
    "text": "Repair the buggy source below without changing the required API.\n\nFile contract: Return solution.rs using only the standard library.\nRequired API: pub fn parse_quoted_list(text: &str) -> Option<Vec<String>>\nBehavior: Parse a comma-separated list in which every field is double-quoted and an embedded double quote is represented by two consecutive quotes. Preserve empty fields; reject unquoted text, whitespace outside quotes, malformed quoting, or trailing data. Empty input represents an empty list.\nVisible example: The text \"a\",\"b\"\"c\",\"\" produces [\"a\", \"b\\\"c\", \"\"].\n\nBuggy source to repair:\n\npub fn parse_quoted_list(s:&str)->Option<Vec<String>>{if s.is_empty(){return Some(vec![])}Some(s.split(',').map(|x|x.trim().replace('\"',\"\")).collect())}\n\nReturn only the complete source file; do not include Markdown fences or prose."
  },
  "runtime_id": "rust-1.85.0",
  "schema_version": "1.0",
  "surface": "development",
  "task_id": "dev-t2-rust-parse-quoted-list",
  "task_type": "repair",
  "validation": {
    "known_bad": [
      {
        "code": "pub fn parse_quoted_list(s:&str)->Option<Vec<String>>{if s.is_empty(){return Some(vec![])}Some(s.split(',').map(|x|x.trim().replace('\"',\"\")).collect())}\n",
        "label": "strip-and-split-parser",
        "sha256": "3abb24ae1dca91637250e8aa3fc88afd30cab171daece3215f89c4840448f017"
      }
    ],
    "reference": {
      "code": "pub fn parse_quoted_list(s:&str)->Option<Vec<String>>{if s.is_empty(){return Some(vec![])}let b=s.as_bytes();let mut i=0;let mut out=vec![];loop{if b.get(i)!=Some(&b'\"'){return None}i+=1;let mut v=String::new();let mut closed=false;while i<b.len(){if b[i]==b'\"'{if b.get(i+1)==Some(&b'\"'){v.push('\"');i+=2}else{i+=1;closed=true;break}}else{v.push(b[i]as char);i+=1}}if !closed{return None}out.push(v);if i==b.len(){return Some(out)}if b.get(i)!=Some(&b',')||i+1==b.len(){return None}i+=1}}\n",
      "label": "author-reference",
      "sha256": "10643a88f372697ba8df24902424ab0c124a0cb9cf680f3b4ea6e5e1b2e87a6e"
    }
  }
}
