{
  "candidate_path": "solution.ts",
  "family": "javascript_typescript",
  "files": [
    {
      "content": "import{boundedPrefixSum}from'./solution';if(boundedPrefixSum([3n,-2n],3n)!==1n)throw Error('sum');if(boundedPrefixSum([5n,-5n],4n)!==null)throw Error('prefix');if(boundedPrefixSum([],-1n)!==null)throw Error('bound');\n",
      "path": "solution.test.ts",
      "role": "test",
      "sha256": "95546fb62f553600ec21a3882aa15f8bd55e293f09f1e24347a19f64b39cecc6"
    }
  ],
  "language": "typescript",
  "limits": {
    "cpus": 1,
    "memory_mb": 512,
    "output_bytes": 65536,
    "pids": 64,
    "timeout_seconds": 30
  },
  "prompt": {
    "sha256": "b1850ac1bcec31422ab87721d9cb7ebcc5bb3da166f1f4c2a9df48ff6d04ab9d",
    "text": "Implement the following API.\n\nFile contract: Return solution.ts and use a named export.\nRequired API: export function boundedPrefixSum(values: readonly bigint[], bound: bigint): bigint | null\nBehavior: Return the exact sum only when every prefix sum, including the initial zero, remains within the inclusive symmetric bound. Reject a negative bound and return the failure value on arithmetic overflow.\nVisible example: With bound 3, [3,-2] succeeds with 1, while [4,-4] fails because its first prefix exceeds the bound.\n\nReturn only the complete source file; do not include Markdown fences or prose."
  },
  "rendered_prompt": {
    "sha256": "b1850ac1bcec31422ab87721d9cb7ebcc5bb3da166f1f4c2a9df48ff6d04ab9d",
    "text": "Implement the following API.\n\nFile contract: Return solution.ts and use a named export.\nRequired API: export function boundedPrefixSum(values: readonly bigint[], bound: bigint): bigint | null\nBehavior: Return the exact sum only when every prefix sum, including the initial zero, remains within the inclusive symmetric bound. Reject a negative bound and return the failure value on arithmetic overflow.\nVisible example: With bound 3, [3,-2] succeeds with 1, while [4,-4] fails because its first prefix exceeds the bound.\n\nReturn only the complete source file; do not include Markdown fences or prose."
  },
  "runtime_id": "typescript-5.5.4-node-22",
  "schema_version": "1.0",
  "surface": "development",
  "task_id": "dev-t1-typescript-bounded-prefix-sum",
  "task_type": "generation",
  "validation": {
    "known_bad": [
      {
        "code": "export function boundedPrefixSum(v:readonly bigint[],b:bigint):bigint|null{const x=v.reduce((a,n)=>a+n,0n);return x<=b&&x>=-b?x:null}\n",
        "label": "final-only-sum",
        "sha256": "9d05852f1b1e3db2b37bc4ab6bbfae55e288a4eaecc8b0e7d907716c28be0ad8"
      }
    ],
    "reference": {
      "code": "export function boundedPrefixSum(v:readonly bigint[],b:bigint):bigint|null{if(b<0n)return null;let x=0n;for(const n of v){x+=n;if(x>b||x < -b)return null}return x}\n",
      "label": "author-reference",
      "sha256": "e31d5f32849f6ca6fdadc95b250d120e678acf8475b81551baea5cf464e8e63e"
    }
  }
}
