{
  "candidate_path": "solution.js",
  "family": "javascript_typescript",
  "files": [
    {
      "content": "const {multisetOverlap}=require('./solution');const a=[3,1,3,2,3],b=[3,3,2];if(JSON.stringify(multisetOverlap(a,b))!=='[3,3,2]'||JSON.stringify(multisetOverlap([],[]))!=='[]'||a.length!==5||b.length!==3)throw Error('overlap');\n",
      "path": "solution.test.js",
      "role": "test",
      "sha256": "f27314610793d9c170e0ff9483b6e2cc3fecbb6cbfb90dd53870037b002175bb"
    }
  ],
  "language": "javascript",
  "limits": {
    "cpus": 1,
    "memory_mb": 512,
    "output_bytes": 65536,
    "pids": 64,
    "timeout_seconds": 30
  },
  "prompt": {
    "sha256": "154db1f84c73c876b6396c5ee5b82c6aa6ad595950f993ef08928dd0b5499f8c",
    "text": "Implement the following API.\n\nFile contract: Write CommonJS module solution.js and export the named function.\nRequired API: exports.multisetOverlap = function(left, right) returning number[]\nBehavior: Treat right as a multiset. Scan left in order and retain each value only while an unused equal occurrence remains in right. Preserve left order, do not mutate either input, and return a non-null empty result when there is no overlap.\nVisible example: For left [3,1,3,2,3] and right [3,3,2], return [3,3,2].\n\nReturn only the complete source file; do not include Markdown fences or prose."
  },
  "rendered_prompt": {
    "sha256": "154db1f84c73c876b6396c5ee5b82c6aa6ad595950f993ef08928dd0b5499f8c",
    "text": "Implement the following API.\n\nFile contract: Write CommonJS module solution.js and export the named function.\nRequired API: exports.multisetOverlap = function(left, right) returning number[]\nBehavior: Treat right as a multiset. Scan left in order and retain each value only while an unused equal occurrence remains in right. Preserve left order, do not mutate either input, and return a non-null empty result when there is no overlap.\nVisible example: For left [3,1,3,2,3] and right [3,3,2], return [3,3,2].\n\nReturn only the complete source file; do not include Markdown fences or prose."
  },
  "runtime_id": "javascript-node-22.23.2",
  "schema_version": "1.0",
  "surface": "development",
  "task_id": "dev-t3-javascript-multiset-overlap",
  "task_type": "generation",
  "validation": {
    "known_bad": [
      {
        "code": "exports.multisetOverlap=function(left,right){const s=new Set(right);return left.filter(x=>s.has(x))}\n",
        "label": "set-instead-of-multiset",
        "sha256": "817cfb1fd4f8223e4ade41b14bcde074c1dde4cef259e5b51352b1d1975f9a6c"
      }
    ],
    "reference": {
      "code": "exports.multisetOverlap=function(left,right){const c=new Map();for(const x of right)c.set(x,(c.get(x)||0)+1);const out=[];for(const x of left){const n=c.get(x)||0;if(n>0){out.push(x);c.set(x,n-1)}}return out}\n",
      "label": "author-reference",
      "sha256": "b606d0c073e0142dbf0959c86d06290ff61076216043785993ab9654af9c66ae"
    }
  }
}
