{
  "candidate_path": "Solution.java",
  "family": "java",
  "files": [
    {
      "content": "public final class SolutionTest{public static void main(String[]z){assert Solution.boundedPrefixSum(new long[]{3,-2},3)==1;assert Solution.boundedPrefixSum(new long[]{5,-5},4)==null;assert Solution.boundedPrefixSum(new long[]{Long.MAX_VALUE,1},Long.MAX_VALUE)==null;assert Solution.boundedPrefixSum(new long[]{},-1)==null;}}\n",
      "path": "SolutionTest.java",
      "role": "test",
      "sha256": "bcfe7ee5e42f59d0cac054b0fb1d28db19533d9a03f897e01a160e9a1dad0e98"
    }
  ],
  "language": "java",
  "limits": {
    "cpus": 1,
    "memory_mb": 512,
    "output_bytes": 65536,
    "pids": 64,
    "timeout_seconds": 30
  },
  "prompt": {
    "sha256": "a1ae7545a96ef863f9e43f308213894aa955f7a70d571adee9fb0c656ac1ba09",
    "text": "Implement the following API.\n\nFile contract: Return Solution.java containing public final class Solution.\nRequired API: public static Long boundedPrefixSum(long[] values, long bound); return null on failure\nBehavior: Return the exact sum only when every prefix sum, including the initial zero, remains within the inclusive symmetric bound. Reject a negative bound and return the failure value on arithmetic overflow.\nVisible example: With bound 3, [3,-2] succeeds with 1, while [4,-4] fails because its first prefix exceeds the bound.\n\nReturn only the complete source file; do not include Markdown fences or prose."
  },
  "rendered_prompt": {
    "sha256": "a1ae7545a96ef863f9e43f308213894aa955f7a70d571adee9fb0c656ac1ba09",
    "text": "Implement the following API.\n\nFile contract: Return Solution.java containing public final class Solution.\nRequired API: public static Long boundedPrefixSum(long[] values, long bound); return null on failure\nBehavior: Return the exact sum only when every prefix sum, including the initial zero, remains within the inclusive symmetric bound. Reject a negative bound and return the failure value on arithmetic overflow.\nVisible example: With bound 3, [3,-2] succeeds with 1, while [4,-4] fails because its first prefix exceeds the bound.\n\nReturn only the complete source file; do not include Markdown fences or prose."
  },
  "runtime_id": "java-21.0.11",
  "schema_version": "1.0",
  "surface": "development",
  "task_id": "dev-t1-java-bounded-prefix-sum",
  "task_type": "generation",
  "validation": {
    "known_bad": [
      {
        "code": "public final class Solution { public static Long boundedPrefixSum(long[]v,long b){long x=0;for(long n:v)x+=n;return x<=b&&x>=-b?x:null;} }\n",
        "label": "final-only-wrapping-sum",
        "sha256": "8225d2cdddaa4ff6b8e5f22468fc64f0fa9d84214776f6692876b9bbc42a2199"
      }
    ],
    "reference": {
      "code": "public final class Solution { public static Long boundedPrefixSum(long[]v,long b){if(b<0)return null;long x=0;for(long n:v){try{x=Math.addExact(x,n);}catch(ArithmeticException e){return null;}if(x>b||x < -b)return null;}return x;} }\n",
      "label": "author-reference",
      "sha256": "7db6ce35e4355453a1c3e3d4ba95e55e69ad7959f336e9935b988a55dc04a04f"
    }
  }
}
