{
  "candidate_path": "solution.js",
  "family": "javascript_typescript",
  "files": [
    {
      "content": "const{alternatingEnds:f}=require('./solution');if(!(f(\"1,2,3,4,5\")===\"1,5,2,4,3\"&&f(\"-1,0,9,8\")===\"-1,8,0,9\"&&f(\"7\")===\"7\"&&f(\"\")===null&&f(\"1, 2\")===null))throw Error('contract');\n",
      "path": "solution.test.js",
      "role": "test",
      "sha256": "fd4b84591b7ee986559e2de20964eee13f2d5827544c1696885e8f251d43923a"
    }
  ],
  "language": "javascript",
  "limits": {
    "cpus": 1,
    "memory_mb": 512,
    "output_bytes": 65536,
    "pids": 64,
    "timeout_seconds": 30
  },
  "prompt": {
    "sha256": "555bb67ca138e36c82b991122ed14ee43c27297f5c0b7c4e862fc2ca525d494d",
    "text": "Implement the following API.\n\nFile contract: Return CommonJS module solution.js.\nRequired API: exports.alternatingEnds = function(input)\nBehavior: Parse a non-empty comma-separated list of canonical signed decimal integers in -1000..1000. Return values by taking leftmost, rightmost, next-leftmost, next-rightmost until exhausted, joined by commas. Reject malformed or out-of-range input.\nVisible example: 1,2,3,4,5 returns 1,5,2,4,3.\n\nReturn only the complete source file; do not include Markdown fences or prose."
  },
  "rendered_prompt": {
    "sha256": "555bb67ca138e36c82b991122ed14ee43c27297f5c0b7c4e862fc2ca525d494d",
    "text": "Implement the following API.\n\nFile contract: Return CommonJS module solution.js.\nRequired API: exports.alternatingEnds = function(input)\nBehavior: Parse a non-empty comma-separated list of canonical signed decimal integers in -1000..1000. Return values by taking leftmost, rightmost, next-leftmost, next-rightmost until exhausted, joined by commas. Reject malformed or out-of-range input.\nVisible example: 1,2,3,4,5 returns 1,5,2,4,3.\n\nReturn only the complete source file; do not include Markdown fences or prose."
  },
  "runtime_id": "javascript-node-22.23.2",
  "schema_version": "1.0",
  "surface": "decision",
  "task_id": "decision-t5-javascript-alternating-ends",
  "task_type": "generation",
  "validation": {
    "known_bad": [
      {
        "code": "exports.alternatingEnds=input=>input;\n",
        "label": "identity-instead-of-contract",
        "sha256": "f8ee2570b6290669f561f8b07a946a8574e61683bf7e12d08224ff1a04701240"
      }
    ],
    "reference": {
      "code": "const nums=s=>{if(!s)return null;let o=[];for(const z of s.split(',')){if(!/^(?:0|-?[1-9][0-9]*)$/.test(z))return null;let x=Number(z);if(x< -1000||x>1000)return null;o.push(x)}return o};exports.alternatingEnds=function(s){let a=nums(s);if(!a)return null;let o=[],i=0,j=a.length-1;while(i<=j){o.push(a[i++]);if(i<=j)o.push(a[j--])}return o.join(',')}\n",
      "label": "author-reference",
      "sha256": "aec79c3d04f910bf93a2a373413d34b79d8cf7e290986ef59f38b4701188075e"
    }
  }
}
