{
  "candidate_path": "Solution.java",
  "family": "java",
  "files": [
    {
      "content": "import java.util.*;public final class SolutionTest{public static void main(String[]z){if(!(Objects.equals(Solution.eventDeduplication(\"5;1:a,3:b,5:a,7:a\"),\"1:a,3:b,7:a\")&&Solution.eventDeduplication(\"5;2:a,1:b\")==null&&Solution.eventDeduplication(\"5;\")==null&&Solution.eventDeduplication(\"5;1:A\")==null&&Solution.eventDeduplication(\"10000001;1:a\")==null))throw new AssertionError();}}\n",
      "path": "SolutionTest.java",
      "role": "test",
      "sha256": "02a47c62be872be9d0822aa435369d83df2e3dab8bbe8e6297bc099e0659c092"
    }
  ],
  "language": "java",
  "limits": {
    "cpus": 1,
    "memory_mb": 512,
    "output_bytes": 65536,
    "pids": 64,
    "timeout_seconds": 60
  },
  "prompt": {
    "sha256": "23784fce94f0667d076f2bb601e859c853e57594a810cbf74d83fe4bc0c57562",
    "text": "Implement the following API.\n\nFile contract: Return Solution.java defining public final class Solution.\nRequired API: public static String eventDeduplication(String input)\nBehavior: Parse window;timestamp:key records. Window and timestamps are canonical unsigned decimals in 0..10000000, records are nondecreasing by timestamp, and keys use ASCII [a-z][a-z0-9]*(?:-[a-z0-9]+)*. Keep an event only when that key has no previously kept event within the inclusive window. Return kept timestamp:key records in input order.\nVisible example: 5;1:a,3:b,5:a,7:a returns 1:a,3:b,7:a.\n\nReturn only the complete source file; do not include Markdown fences or prose."
  },
  "rendered_prompt": {
    "sha256": "23784fce94f0667d076f2bb601e859c853e57594a810cbf74d83fe4bc0c57562",
    "text": "Implement the following API.\n\nFile contract: Return Solution.java defining public final class Solution.\nRequired API: public static String eventDeduplication(String input)\nBehavior: Parse window;timestamp:key records. Window and timestamps are canonical unsigned decimals in 0..10000000, records are nondecreasing by timestamp, and keys use ASCII [a-z][a-z0-9]*(?:-[a-z0-9]+)*. Keep an event only when that key has no previously kept event within the inclusive window. Return kept timestamp:key records in input order.\nVisible example: 5;1:a,3:b,5:a,7:a returns 1:a,3:b,7:a.\n\nReturn only the complete source file; do not include Markdown fences or prose."
  },
  "runtime_id": "java-21.0.11",
  "schema_version": "1.0",
  "surface": "decision",
  "task_id": "decision-t3-java-event-deduplication",
  "task_type": "generation",
  "validation": {
    "known_bad": [
      {
        "code": "public final class Solution{public static String eventDeduplication(String input){return input;}}\n",
        "label": "identity-instead-of-contract",
        "sha256": "daf9e702e2e8f02943733c4c612c1feeb645f6870b0b033479658712a59546ed"
      }
    ],
    "reference": {
      "code": "import java.util.*;public final class Solution{public static String eventDeduplication(String s){try{String[]p=s.split(\";\",-1);if(p.length!=2||p[1].isEmpty()||!p[0].matches(\"0|[1-9][0-9]*\"))return null;long w=Long.parseLong(p[0]),prev=-1;if(w>10000000)return null;var last=new HashMap<String,Long>();var o=new ArrayList<String>();for(String r:p[1].split(\",\",-1)){String[]q=r.split(\":\",-1);if(q.length!=2||!q[0].matches(\"0|[1-9][0-9]*\")||!q[1].matches(\"[a-z][a-z0-9]*(?:-[a-z0-9]+)*\"))return null;long t=Long.parseLong(q[0]);if(t>10000000||t<prev)return null;prev=t;if(!last.containsKey(q[1])||t-last.get(q[1])>w){last.put(q[1],t);o.add(r);}}return String.join(\",\",o);}catch(Exception e){return null;}}}\n",
      "label": "author-reference",
      "sha256": "6e8e0b2126d88ead6fed3bd3ada492ad880ed788a6604452e4f87c3f441118d5"
    }
  }
}
