{
  "candidate_path": "Solution.java",
  "family": "java",
  "files": [
    {
      "content": "public final class SolutionTest{public static void main(String[]z){if(!(\"4:3,2:2\".equals(Solution.stableFrequencies(\"4,2,4,4,2\"))&&\"-1:2,0:1\".equals(Solution.stableFrequencies(\"-1,-1,0\"))&&\"7:1\".equals(Solution.stableFrequencies(\"7\"))&&Solution.stableFrequencies(\"1.0\")==null&&Solution.stableFrequencies(\"\")==null))throw new AssertionError();}}\n",
      "path": "SolutionTest.java",
      "role": "test",
      "sha256": "1362f036ded529f8ca7dd053fdb768b6c9e5b716889b7641b95bb76753eab456"
    }
  ],
  "language": "java",
  "limits": {
    "cpus": 1,
    "memory_mb": 512,
    "output_bytes": 65536,
    "pids": 64,
    "timeout_seconds": 60
  },
  "prompt": {
    "sha256": "8e42397d7e7664a872ad8b0465e9fe5b4f00a413c99d55536042dd833a73f1ea",
    "text": "Implement the following API.\n\nFile contract: Return Solution.java defining public final class Solution.\nRequired API: public static String stableFrequencies(String input)\nBehavior: Parse a non-empty comma-separated list of canonical signed integers in -1000..1000. For each distinct value in first-occurrence order, return value:count, joined by commas. Reject every malformed input by returning the language-specific absence value.\nVisible example: 4,2,4,4,2 returns 4:3,2:2.\n\nReturn only the complete source file; do not include Markdown fences or prose."
  },
  "rendered_prompt": {
    "sha256": "8e42397d7e7664a872ad8b0465e9fe5b4f00a413c99d55536042dd833a73f1ea",
    "text": "Implement the following API.\n\nFile contract: Return Solution.java defining public final class Solution.\nRequired API: public static String stableFrequencies(String input)\nBehavior: Parse a non-empty comma-separated list of canonical signed integers in -1000..1000. For each distinct value in first-occurrence order, return value:count, joined by commas. Reject every malformed input by returning the language-specific absence value.\nVisible example: 4,2,4,4,2 returns 4:3,2:2.\n\nReturn only the complete source file; do not include Markdown fences or prose."
  },
  "runtime_id": "java-21.0.11",
  "schema_version": "1.0",
  "surface": "decision",
  "task_id": "decision-t6-java-stable-frequencies",
  "task_type": "generation",
  "validation": {
    "known_bad": [
      {
        "code": "public final class Solution{public static String stableFrequencies(String input){return input;}}\n",
        "label": "identity-instead-of-contract",
        "sha256": "6a7e8d2bed9eae111ab7615e754bfc1b01615a1990df1cd25ec5382c0d793b0d"
      }
    ],
    "reference": {
      "code": "import java.util.*;public final class Solution{static List<Integer>n(String s){if(s.isEmpty())return null;var o=new ArrayList<Integer>();for(var z:s.split(\",\",-1)){if(!z.matches(\"(?:0|-?[1-9][0-9]*)\"))return null;try{int x=Integer.parseInt(z);if(x< -1000||x>1000)return null;o.add(x);}catch(Exception e){return null;}}return o;}static String j(List<?>a){return String.join(\",\",a.stream().map(Object::toString).toList());}public static String stableFrequencies(String s){int m=4,k=0,lo=0,hi=0;List<Integer>a;String[]q;if(m==3){q=s.split(\";\",-1);if(q.length!=2)return null;var x=n(q[0]);a=n(q[1]);if(x==null||a==null||x.size()!=1||x.get(0)<0)return null;k=x.get(0)%a.size();}else if(m==5){q=s.split(\";\",-1);if(q.length!=3)return null;var x=n(q[0]);var y=n(q[1]);a=n(q[2]);if(x==null||y==null||a==null||x.size()!=1||y.size()!=1||x.get(0)>y.get(0))return null;lo=x.get(0);hi=y.get(0);}else if((a=n(s))==null)return null;var o=new ArrayList<Integer>();if(m==0){for(int i=1;i<a.size();i++)o.add(Math.max(-1000,Math.min(1000,a.get(i)-a.get(i-1))));}else if(m==1){int z=a.get(0);for(int x:a){z=Math.max(z,x);o.add(z);}}else if(m==2){for(int x:a)o.add(0);int z=a.get(a.size()-1);for(int i=a.size()-1;i>=0;i--){z=Math.min(z,a.get(i));o.set(i,z);}}else if(m==3){o.addAll(a.subList(a.size()-k,a.size()));o.addAll(a.subList(0,a.size()-k));}else if(m==4){var c=new LinkedHashMap<Integer,Integer>();for(int x:a)c.put(x,c.getOrDefault(x,0)+1);return String.join(\",\",c.entrySet().stream().map(e->e.getKey()+\":\"+e.getValue()).toList());}else if(m==5){for(int x:a)o.add(Math.max(lo,Math.min(hi,x)));}else if(m==6){for(int i=1;i<a.size();i++)o.add(a.get(i-1)*a.get(i));}else if(m==7){for(int x:a)if(x%2==0)o.add(x);for(int x:a)if(x%2!=0)o.add(x);}else if(m==8){int z=0;for(int i=0;i<a.size();i++){z+=i%2==0?a.get(i):-a.get(i);o.add(z);}}else{int bv=a.get(0),bl=1,cv=bv,cl=1;for(int x:a.subList(1,a.size())){if(x==cv)cl++;else{cv=x;cl=1;}if(cl>bl){bv=cv;bl=cl;}}return bv+\":\"+bl;}return j(o);}}\n",
      "label": "author-reference",
      "sha256": "e799d7337269986db594ba93a8d5066feaaa5711f4940131ce00e86238c11a54"
    }
  }
}
