{
  "candidate_path": "Solution.java",
  "family": "java",
  "files": [
    {
      "content": "public final class SolutionTest{public static void main(String[]z){if(!(\"2,0,2,1\".equals(Solution.rankCompress(\"40,10,40,20\"))&&\"0,1,2\".equals(Solution.rankCompress(\"-2,-1,0\"))&&\"0,0\".equals(Solution.rankCompress(\"5,5\"))&&Solution.rankCompress(\"--1\")==null&&Solution.rankCompress(\"\")==null))throw new AssertionError();}}\n",
      "path": "SolutionTest.java",
      "role": "test",
      "sha256": "21797ccd84d2e57d750f421c553f18e9f41e08f26e81ce5025a78024187c1082"
    }
  ],
  "language": "java",
  "limits": {
    "cpus": 1,
    "memory_mb": 512,
    "output_bytes": 65536,
    "pids": 64,
    "timeout_seconds": 60
  },
  "prompt": {
    "sha256": "39e8c6ece77b661a6275f62d139fb7c43bd08083031982869057a92d1827427e",
    "text": "Repair the buggy source below without changing the required API.\n\nFile contract: Return Solution.java defining public final class Solution.\nRequired API: public static String rankCompress(String input)\nBehavior: Parse a non-empty comma-separated list of canonical signed decimal integers in -1000..1000. Replace each value by its zero-based index in the increasing sorted set of distinct input values and return the ranks in input order, joined by commas. Reject malformed or out-of-range input.\nVisible example: 40,10,40,20 returns 2,0,2,1.\n\nBuggy source to repair:\n\npublic final class Solution{public static String rankCompress(String input){return input;}}\n\nReturn only the complete source file; do not include Markdown fences or prose."
  },
  "rendered_prompt": {
    "sha256": "39e8c6ece77b661a6275f62d139fb7c43bd08083031982869057a92d1827427e",
    "text": "Repair the buggy source below without changing the required API.\n\nFile contract: Return Solution.java defining public final class Solution.\nRequired API: public static String rankCompress(String input)\nBehavior: Parse a non-empty comma-separated list of canonical signed decimal integers in -1000..1000. Replace each value by its zero-based index in the increasing sorted set of distinct input values and return the ranks in input order, joined by commas. Reject malformed or out-of-range input.\nVisible example: 40,10,40,20 returns 2,0,2,1.\n\nBuggy source to repair:\n\npublic final class Solution{public static String rankCompress(String input){return input;}}\n\nReturn only the complete source file; do not include Markdown fences or prose."
  },
  "runtime_id": "java-21.0.11",
  "schema_version": "1.0",
  "surface": "decision",
  "task_id": "decision-t5-java-rank-compress",
  "task_type": "repair",
  "validation": {
    "known_bad": [
      {
        "code": "public final class Solution{public static String rankCompress(String input){return input;}}\n",
        "label": "identity-instead-of-contract",
        "sha256": "1ae80c39effa09199e2ccef8c40463cfae87c58cd04b5d38c178945b3db87fa1"
      }
    ],
    "reference": {
      "code": "import java.util.*;public final class Solution{\nstatic List<Integer> n(String s){if(s.isEmpty())return null;var o=new ArrayList<Integer>();for(var z:s.split(\",\",-1)){if(!z.matches(\"(?:0|-?[1-9][0-9]*)\"))return null;try{int x=Integer.parseInt(z);if(x< -1000||x>1000)return null;o.add(x);}catch(Exception e){return null;}}return o;}\nstatic String j(List<?>a){return String.join(\",\",a.stream().map(Object::toString).toList());}\npublic static String rankCompress(String s){int mode=9;List<Integer>a;int t=0,b=0;String[]q=s.split(\";\",-1);if(mode==0||mode==2){if(q.length!=2)return null;var x=n(q[0]);a=n(q[1]);if(x==null||a==null||x.size()!=1||(mode==0&&a.size()!=1))return null;t=x.get(0);if(mode==0)b=a.get(0);}else if((a=n(s))==null)return null;\nif(mode==0)return Integer.toString(Math.abs(t-b));if(mode==1){var o=new ArrayList<Integer>();for(int i=0,k=a.size()-1;i<=k;i++,k--){o.add(a.get(i));if(i<k)o.add(a.get(k));}return j(o);}if(mode==2){var o=new ArrayList<Integer>();for(int x:a)if(x<t)o.add(x);for(int x:a)if(x>=t)o.add(x);return j(o);}if(mode==3){var o=new TreeSet<Integer>();for(int x:a)o.add(x*x);return j(new ArrayList<>(o));}if(mode==4){var o=new ArrayList<Integer>();for(int i=0;i<a.size();i++)o.add(a.get((i+1)%a.size())-a.get(i));return j(o);}if(mode==5)return j(new ArrayList<>(new LinkedHashSet<>(a)));if(mode==6){var o=new ArrayList<Integer>();for(int i=0;i+2<a.size();i++)o.add(a.get(i)+a.get(i+1)+a.get(i+2));return j(o);}if(mode==7){int m=a.stream().mapToInt(Math::abs).max().getAsInt();return j(a.stream().filter(x->Math.abs(x)==m).toList());}if(mode==8){var o=new ArrayList<Integer>();int z=0;boolean seen=false;for(int i=0;i<=a.size();i++){int x=i==a.size()?0:a.get(i);if(x==0){if(seen)o.add(z);z=0;seen=false;}else{z+=x;seen=true;}}return j(o);}var u=new TreeSet<Integer>(a);var r=new HashMap<Integer,Integer>();int i=0;for(int x:u)r.put(x,i++);return j(a.stream().map(r::get).toList());}\n}\n",
      "label": "author-reference",
      "sha256": "4d2d31f692b1a8e947d0ac947680f639bc5e56f59b450a878f4bfa23f1fe71a5"
    }
  }
}
