{
  "candidate_path": "solution.py",
  "family": "python",
  "files": [
    {
      "content": "from solution import version_selection\nassert version_selection('2.1.0;1.9.9,2.1.1,2.0.5')=='2.0.5'\nassert version_selection('1.0.0;2.0.0')==''\nassert version_selection('1.0.0;1.0.0,1.0.0') is None\nassert version_selection('01.0.0;1.0.0') is None\nassert version_selection('1.0;1.0.0') is None\nassert version_selection('1.0.0;') is None\n",
      "path": "test_solution.py",
      "role": "test",
      "sha256": "3befaea11f0bb69af5a53a5b19b7363054a3bece6dff80a8423fbbb38dcc32bf"
    }
  ],
  "language": "python",
  "limits": {
    "cpus": 1,
    "memory_mb": 512,
    "output_bytes": 65536,
    "pids": 64,
    "timeout_seconds": 30
  },
  "prompt": {
    "sha256": "5bafc2292d97ca684ffac5ca780a5f9e9cdaf791c1d159b3b249e71626419c65",
    "text": "Repair the buggy source below without changing the required API.\n\nFile contract: Return solution.py with the function at module scope.\nRequired API: def version_selection(input: str) -> str | None\nBehavior: Parse ceiling;version,version. Ceiling and versions are canonical major.minor.patch triples with each component in 0..1000000; at least one version is required and duplicates are invalid. Return the greatest version not above the ceiling using numeric component order, or the empty string when none qualifies.\nVisible example: 2.1.0;1.9.9,2.1.1,2.0.5 returns 2.0.5.\n\nBuggy source to repair:\n\ndef version_selection(input: str) -> str | None:\n return input\n\nReturn only the complete source file; do not include Markdown fences or prose."
  },
  "rendered_prompt": {
    "sha256": "5bafc2292d97ca684ffac5ca780a5f9e9cdaf791c1d159b3b249e71626419c65",
    "text": "Repair the buggy source below without changing the required API.\n\nFile contract: Return solution.py with the function at module scope.\nRequired API: def version_selection(input: str) -> str | None\nBehavior: Parse ceiling;version,version. Ceiling and versions are canonical major.minor.patch triples with each component in 0..1000000; at least one version is required and duplicates are invalid. Return the greatest version not above the ceiling using numeric component order, or the empty string when none qualifies.\nVisible example: 2.1.0;1.9.9,2.1.1,2.0.5 returns 2.0.5.\n\nBuggy source to repair:\n\ndef version_selection(input: str) -> str | None:\n return input\n\nReturn only the complete source file; do not include Markdown fences or prose."
  },
  "runtime_id": "python-3.11.15",
  "schema_version": "1.0",
  "surface": "decision",
  "task_id": "decision-t3-python-version-selection",
  "task_type": "repair",
  "validation": {
    "known_bad": [
      {
        "code": "def version_selection(input: str) -> str | None:\n return input\n",
        "label": "identity-instead-of-contract",
        "sha256": "8699fe5f425b3aa483b1de5afb71a67bc673d27cdc0bf29c654e87f35f75d70e"
      }
    ],
    "reference": {
      "code": "import re\ndef version_selection(s):\n p=s.split(';')\n if len(p)!=2 or not p[1]:return None\n def v(x):\n  q=x.split('.')\n  return tuple(map(int,q)) if len(q)==3 and all(re.fullmatch(r'0|[1-9][0-9]*',z) and int(z)<=1000000 for z in q) else None\n c=v(p[0]);seen=set();best=None\n if c is None:return None\n for x in p[1].split(','):\n  q=v(x)\n  if q is None or q in seen:return None\n  seen.add(q)\n  if q<=c and (best is None or q>best):best=q\n return '' if best is None else '.'.join(map(str,best))\n",
      "label": "author-reference",
      "sha256": "f89ba7caa590d468aa43a8a86bd7e0fdc9f4a43def9256687894f98de7968a51"
    }
  }
}
