{
  "candidate_path": "solution.py",
  "family": "python",
  "files": [
    {
      "content": "from solution import collapse_runs\nx=[2,2,1,1,3,2,2]\nassert collapse_runs(x)==[2,1,3,2]\nassert collapse_runs([])==[]\nassert x==[2,2,1,1,3,2,2]\n",
      "path": "test_solution.py",
      "role": "test",
      "sha256": "319c860c2f396597a37d352c4abd151a8b7d7215d81b9fd0962f8408857dd35e"
    }
  ],
  "language": "python",
  "limits": {
    "cpus": 1,
    "memory_mb": 512,
    "output_bytes": 65536,
    "pids": 64,
    "timeout_seconds": 30
  },
  "prompt": {
    "sha256": "15da37cf9b669137f6f233cd2a3757f5ba08ab1309ff4c43ed1cbb6eda7dd236",
    "text": "Implement the following API.\n\nFile contract: Return solution.py with the function at module scope.\nRequired API: def collapse_runs(values: list[int]) -> list[int]\nBehavior: Return one value for each maximal adjacent run. Preserve order, do not mutate input, and return a non-null empty collection for empty input.\nVisible example: [2,2,1,1,2] becomes [2,1,2].\n\nReturn only the complete source file; do not include Markdown fences or prose."
  },
  "rendered_prompt": {
    "sha256": "15da37cf9b669137f6f233cd2a3757f5ba08ab1309ff4c43ed1cbb6eda7dd236",
    "text": "Implement the following API.\n\nFile contract: Return solution.py with the function at module scope.\nRequired API: def collapse_runs(values: list[int]) -> list[int]\nBehavior: Return one value for each maximal adjacent run. Preserve order, do not mutate input, and return a non-null empty collection for empty input.\nVisible example: [2,2,1,1,2] becomes [2,1,2].\n\nReturn only the complete source file; do not include Markdown fences or prose."
  },
  "runtime_id": "python-3.11.15",
  "schema_version": "1.0",
  "surface": "development",
  "task_id": "dev-t1-python-collapse-runs",
  "task_type": "generation",
  "validation": {
    "known_bad": [
      {
        "code": "def collapse_runs(values: list[int]) -> list[int]:\n    return values[:1] if values else None\n",
        "label": "null-empty-and-truncation",
        "sha256": "fc62dde5d1fb6d2ffbf3e0866986b0942f1e908cce169d346097bc76ef280004"
      }
    ],
    "reference": {
      "code": "def collapse_runs(values: list[int]) -> list[int]:\n    out=[]\n    for value in values:\n        if not out or out[-1] != value: out.append(value)\n    return out\n",
      "label": "author-reference",
      "sha256": "b2f67a1f2677644f88cf895c8a672e562455680d8359f931b0a681854ea7cfd1"
    }
  }
}
