{
  "candidate_path": "Solution.java",
  "family": "java",
  "files": [
    {
      "content": "import java.util.*;public final class SolutionTest{public static void main(String[]z){assert Solution.compactOrderedEvents(List.of(1,2,3,8),List.of(\"a\",\"b\",\"a\",\"c\"),List.of(4,7,9,2)).equals(List.of(7,9,2));assert Solution.compactOrderedEvents(List.of(2,2),List.of(\"a\",\"b\"),List.of(1,2))==null;assert Solution.compactOrderedEvents(List.of(1),List.of(),List.of())==null;assert Solution.compactOrderedEvents(List.of(),List.of(),List.of()).isEmpty();}}\n",
      "path": "SolutionTest.java",
      "role": "test",
      "sha256": "522a7e41081b101c8d712b98af3d35413a19d27b1fcfc61785cd3e6385b5ebcb"
    }
  ],
  "language": "java",
  "limits": {
    "cpus": 1,
    "memory_mb": 512,
    "output_bytes": 65536,
    "pids": 64,
    "timeout_seconds": 60
  },
  "prompt": {
    "sha256": "89548802f1716fb38c9dc9c23a9a0d4d287bb6ff77b0f982dc6642eed41176bc",
    "text": "Repair the buggy source below without changing the required API.\n\nFile contract: Write final class Solution in Solution.java with the static method shown; java.util types may be imported.\nRequired API: public static List<Integer> compactOrderedEvents(List<Integer> seq, List<String> keys, List<Integer> values)\nBehavior: The three arrays encode events with strictly increasing sequence numbers. Reject unequal lengths, non-increasing sequence numbers, or empty keys. Keep only the final event for each key and return its value, ordered by the final events' positions; empty input succeeds.\nVisible example: seq [1,2,3,8], keys [a,b,a,c], values [4,7,9,2] return [7,9,2].\n\nBuggy source to repair:\n\nimport java.util.*;public final class Solution{public static List<Integer> compactOrderedEvents(List<Integer>seq,List<String>keys,List<Integer>values){if(seq.size()!=keys.size()||seq.size()!=values.size())return null;var seen=new HashSet<String>();var out=new ArrayList<Integer>();for(int i=0;i<keys.size();i++)if(seen.add(keys.get(i)))out.add(values.get(i));return out;}}\n\nReturn only the complete source file; do not include Markdown fences or prose."
  },
  "rendered_prompt": {
    "sha256": "89548802f1716fb38c9dc9c23a9a0d4d287bb6ff77b0f982dc6642eed41176bc",
    "text": "Repair the buggy source below without changing the required API.\n\nFile contract: Write final class Solution in Solution.java with the static method shown; java.util types may be imported.\nRequired API: public static List<Integer> compactOrderedEvents(List<Integer> seq, List<String> keys, List<Integer> values)\nBehavior: The three arrays encode events with strictly increasing sequence numbers. Reject unequal lengths, non-increasing sequence numbers, or empty keys. Keep only the final event for each key and return its value, ordered by the final events' positions; empty input succeeds.\nVisible example: seq [1,2,3,8], keys [a,b,a,c], values [4,7,9,2] return [7,9,2].\n\nBuggy source to repair:\n\nimport java.util.*;public final class Solution{public static List<Integer> compactOrderedEvents(List<Integer>seq,List<String>keys,List<Integer>values){if(seq.size()!=keys.size()||seq.size()!=values.size())return null;var seen=new HashSet<String>();var out=new ArrayList<Integer>();for(int i=0;i<keys.size();i++)if(seen.add(keys.get(i)))out.add(values.get(i));return out;}}\n\nReturn only the complete source file; do not include Markdown fences or prose."
  },
  "runtime_id": "java-21.0.11",
  "schema_version": "1.0",
  "surface": "development",
  "task_id": "dev-t5-java-ordered-event-compaction",
  "task_type": "repair",
  "validation": {
    "known_bad": [
      {
        "code": "import java.util.*;public final class Solution{public static List<Integer> compactOrderedEvents(List<Integer>seq,List<String>keys,List<Integer>values){if(seq.size()!=keys.size()||seq.size()!=values.size())return null;var seen=new HashSet<String>();var out=new ArrayList<Integer>();for(int i=0;i<keys.size();i++)if(seen.add(keys.get(i)))out.add(values.get(i));return out;}}\n",
        "label": "keeps-first-occurrence",
        "sha256": "0579e9b8efa6336dde3aef9a6f3a652a0a293a71110fde360fc4d73b622d99da"
      }
    ],
    "reference": {
      "code": "import java.util.*;public final class Solution{public static List<Integer> compactOrderedEvents(List<Integer>seq,List<String>keys,List<Integer>values){if(seq.size()!=keys.size()||seq.size()!=values.size())return null;var last=new HashMap<String,Integer>();for(int i=0;i<seq.size();i++){if(i>0&&seq.get(i)<=seq.get(i-1)||keys.get(i).isEmpty())return null;last.put(keys.get(i),i);}var out=new ArrayList<Integer>();for(int i=0;i<keys.size();i++)if(last.get(keys.get(i))==i)out.add(values.get(i));return out;}}\n",
      "label": "author-reference",
      "sha256": "40f5ffe296b5a72d3ece65a785dbdf783bbc5bf7bb0c3cd2ff40d45e93995162"
    }
  }
}
