{
  "candidate_path": "solution.go",
  "family": "go",
  "files": [
    {
      "content": "module private.invalid/ganesh/development/tranche1\n\ngo 1.22\n",
      "path": "go.mod",
      "role": "support",
      "sha256": "741cd266f37fc784f90cd783062a5b5a0f331cb9202a2896e9f06aa762024f6c"
    },
    {
      "content": "package solution\nimport \"testing\"\nfunc TestKeep(t *testing.T){in:=[]string{\"a\",\"b\",\"a\",\"c\",\"b\"};g:=KeepLast(in);w:=[]string{\"a\",\"c\",\"b\"};if len(g)!=3{t.Fatal(g)};for i:=range w{if g[i]!=w[i]{t.Fatal(g)}};if KeepLast(nil)==nil{t.Fatal(\"nil\")};if in[0]!=\"a\"{t.Fatal(\"mutated\")}}\n",
      "path": "solution_test.go",
      "role": "test",
      "sha256": "8bb39fb5edbba3be5d5997cbb086b1bf337ef7373be361948d7ea213d802603f"
    }
  ],
  "language": "go",
  "limits": {
    "cpus": 1,
    "memory_mb": 512,
    "output_bytes": 65536,
    "pids": 64,
    "timeout_seconds": 60
  },
  "prompt": {
    "sha256": "d6c966bdc01cda5395ea006d2c4985656928f496be3298f43214d9e6f1017ac0",
    "text": "Repair the buggy source below without changing the required API.\n\nFile contract: Return solution.go using package solution.\nRequired API: func KeepLast(values []string) []string\nBehavior: Keep only the last occurrence of each exact string while preserving the retained elements' original order. Do not mutate input and return a non-null empty collection.\nVisible example: [\"a\",\"b\",\"a\",\"c\",\"b\"] becomes [\"a\",\"c\",\"b\"].\n\nBuggy source to repair:\n\npackage solution\nfunc KeepLast(v []string)[]string{seen:=map[string]bool{};out:=[]string{};for _,x:=range v{if !seen[x]{seen[x]=true;out=append(out,x)}};return out}\n\nReturn only the complete source file; do not include Markdown fences or prose."
  },
  "rendered_prompt": {
    "sha256": "d6c966bdc01cda5395ea006d2c4985656928f496be3298f43214d9e6f1017ac0",
    "text": "Repair the buggy source below without changing the required API.\n\nFile contract: Return solution.go using package solution.\nRequired API: func KeepLast(values []string) []string\nBehavior: Keep only the last occurrence of each exact string while preserving the retained elements' original order. Do not mutate input and return a non-null empty collection.\nVisible example: [\"a\",\"b\",\"a\",\"c\",\"b\"] becomes [\"a\",\"c\",\"b\"].\n\nBuggy source to repair:\n\npackage solution\nfunc KeepLast(v []string)[]string{seen:=map[string]bool{};out:=[]string{};for _,x:=range v{if !seen[x]{seen[x]=true;out=append(out,x)}};return out}\n\nReturn only the complete source file; do not include Markdown fences or prose."
  },
  "runtime_id": "go-1.22.12",
  "schema_version": "1.0",
  "surface": "development",
  "task_id": "dev-t1-go-keep-last",
  "task_type": "repair",
  "validation": {
    "known_bad": [
      {
        "code": "package solution\nfunc KeepLast(v []string)[]string{seen:=map[string]bool{};out:=[]string{};for _,x:=range v{if !seen[x]{seen[x]=true;out=append(out,x)}};return out}\n",
        "label": "keeps-first-occurrence",
        "sha256": "805cc5f8458d32589e7fb45766fb54da2ccc86d8417af28522cb19ac4298271d"
      }
    ],
    "reference": {
      "code": "package solution\nfunc KeepLast(v []string)[]string{seen:=map[string]bool{};r:=[]string{};for i:=len(v)-1;i>=0;i--{if !seen[v[i]]{seen[v[i]]=true;r=append(r,v[i])}};out:=make([]string,len(r));for i:=range r{out[len(r)-1-i]=r[i]};return out}\n",
      "label": "author-reference",
      "sha256": "af5a96579cb0b2faf10820a505c3251d0946309b6937bfcd5d78fe28942a3ad9"
    }
  }
}
