{
  "candidate_path": "solution.ts",
  "family": "javascript_typescript",
  "files": [
    {
      "content": "import{escapedFieldParser as f}from'./solution';if(f(\"a\\\\,b,c\\\\\\\\d,\")!==\"a,b|c\\\\d|\"||f(\"x,,y\")!==\"x||y\"||f(\"\")!==\"\"||f(\"a\\\\q\")!==null||f(\"tail\\\\\")!==null||f(\"\\\\\\\\,\")!==\"\\\\|\")throw Error('contract');\n",
      "path": "solution.test.ts",
      "role": "test",
      "sha256": "2418a3d6fb3304a80c2b698607ae29cc19daae905126af669bcab44bb4f6e554"
    }
  ],
  "language": "typescript",
  "limits": {
    "cpus": 1,
    "memory_mb": 512,
    "output_bytes": 65536,
    "pids": 64,
    "timeout_seconds": 30
  },
  "prompt": {
    "sha256": "2e1642a8d82a11ed0f1c951cdebaa5b2ed192bb62d3418136d83af14e55e2dcd",
    "text": "Implement the following API.\n\nFile contract: Return strict TypeScript module solution.ts.\nRequired API: export function escapedFieldParser(input: string): string | null\nBehavior: Parse comma-separated fields where backslash may escape only comma or backslash. Empty fields are retained. Reject a dangling backslash or any other escape. Return decoded fields joined by |.\nVisible example: a\\,b,c\\\\d, returns a,b|c\\d|; a\\q is invalid.\n\nReturn only the complete source file; do not include Markdown fences or prose."
  },
  "rendered_prompt": {
    "sha256": "2e1642a8d82a11ed0f1c951cdebaa5b2ed192bb62d3418136d83af14e55e2dcd",
    "text": "Implement the following API.\n\nFile contract: Return strict TypeScript module solution.ts.\nRequired API: export function escapedFieldParser(input: string): string | null\nBehavior: Parse comma-separated fields where backslash may escape only comma or backslash. Empty fields are retained. Reject a dangling backslash or any other escape. Return decoded fields joined by |.\nVisible example: a\\,b,c\\\\d, returns a,b|c\\d|; a\\q is invalid.\n\nReturn only the complete source file; do not include Markdown fences or prose."
  },
  "runtime_id": "typescript-5.5.4-node-22",
  "schema_version": "1.0",
  "surface": "decision",
  "task_id": "decision-t1-typescript-escaped-field-parser",
  "task_type": "generation",
  "validation": {
    "known_bad": [
      {
        "code": "export function escapedFieldParser(input:string):string|null{return input}\n",
        "label": "identity-instead-of-contract",
        "sha256": "459d0a4bfd97108041425b6fd9e2684f051af6eb225682cf0a56197bb7e0a661"
      }
    ],
    "reference": {
      "code": "function run(s:string,m:number):string|null{\n try{\n if(m===0){s=s.replace(/^ +| +$/g,'');const p:string[]=s.split(':');return p.length===3&&/^[a-z]+$/.test(p[0])&&/^[a-z0-9]+(?:-[a-z0-9]+)*$/.test(p[1])&&/^(?:0|[1-9][0-9]*)$/.test(p[2])&&BigInt(p[2])<=9223372036854775807n?s:null}\n if(m===1){const o:string[]=[];let b='',e=false;for(const c of s){if(e){if(c!==','&&c!=='\\\\')return null;b+=c;e=false}else if(c==='\\\\')e=true;else if(c===','){o.push(b);b=''}else b+=c}if(e)return null;o.push(b);return o.join('|')}\n if(m===2){const d=new Map<string,bigint>();for(const r of s.split(';')){const p=r.split('=');if(p.length!==2||!/^[a-z0-9]+(?:-[a-z0-9]+)*$/.test(p[0])||!/^(?:0|[1-9][0-9]*)$/.test(p[1]))return null;const v=(d.get(p[0])??0n)+BigInt(p[1]);if(v>9223372036854775807n)return null;d.set(p[0],v)}return[...d].sort(([a],[b])=>a<b?-1:a>b?1:0).map(([k,v])=>k+'='+v).join(';')}\n if(m===3){const o:number[]=[];for(const [i,x]of s.split(',').entries()){if(!/^[1-5][0-9]{2}$/.test(x))return null;const c=Number(x);if(c>=200&&c<=299)return o.join(',');if([408,429,500,502,503,504].includes(c))o.push(i);else return'fatal@'+i}return o.join(',')}\n if(m===4){const p=s.split(';');if(p.length!==2||!/^[1-9]\\d*$/.test(p[0])||BigInt(p[0])>2147483647n||/[^SF]/.test(p[1]))return null;const n=Number(p[0]);let f=0,open=false,o='';for(const c of p[1]){if(!open){f=c==='S'?0:f+1;open=f>=n}o+=open?'O':'C'}return o}\n if(m===5){const parts=s.split(';');if(parts.length!==2)return null;const [h,b]=parts,a=h.split(','),signed=/^(?:0|-?[1-9]\\d*)$/,unsigned=/^(?:0|[1-9]\\d*)$/,lo=-9223372036854775808n,hi=9223372036854775807n;if(a.length!==3||!signed.test(a[0])||!signed.test(a[1])||!unsigned.test(a[2]))return null;const start=BigInt(a[0]),end=BigInt(a[1]),limit=BigInt(a[2]);if(start<lo||start>hi||end<lo||end>hi||start>end||limit>2147483647n)return null;let rows:Array<[bigint,number,bigint]>=[];if(b)for(const [i,r]of b.split(',').entries()){const at=r.indexOf('='),p=[r.slice(0,at),r.slice(at+1)];if(at<0||!signed.test(p[0])||!signed.test(p[1]))return null;const t=BigInt(p[0]),v=BigInt(p[1]);if(t<lo||t>hi||v<lo||v>hi)return null;if(t>=start&&t<end)rows.push([t,i,v])}rows.sort((a,b)=>a[0]<b[0]?-1:a[0]>b[0]?1:a[1]-b[1]);rows=limit!==0n?rows.slice(-Number(limit)):[];const sum=rows.reduce((q,x)=>q+x[2],0n);return sum>=lo&&sum<=hi?rows.length+':'+sum:null}\n if(m===6){const p=s.split(',');if(!p.length||p.some(x=>!['TIMEOUT','IO','AUTH','BAD_INPUT'].includes(x)))return null;const t=p.filter(x=>x==='TIMEOUT'||x==='IO').length;return`permanent=${p.length-t};transient=${t}`}\n if(m===7){const p=s.split(';');if(p.length!==2)return null;const d:Record<string,string>=Object.create(null) as Record<string,string>,k=/^[a-z][a-z0-9]*(?:-[a-z0-9]+)*$/;if(p[0])for(const r of p[0].split(',')){const at=r.indexOf('='),key=r.slice(0,at),value=r.slice(at+1);if(at<0||!k.test(key)||Object.hasOwn(d,key))return null;d[key]=value}if(p[1])for(const op of p[1].split(',')){if(op.startsWith('set:')){const x=op.slice(4),at=x.indexOf('='),key=x.slice(0,at),value=x.slice(at+1);if(at<0||!k.test(key))return null;d[key]=value}else if(op.startsWith('unset:')&&k.test(op.slice(6)))delete d[op.slice(6)];else return null}return Object.keys(d).sort().map(key=>key+'='+d[key]).join(',')}\n if(m===8){if([...s].some(c=>c.charCodeAt(0)<32||c.charCodeAt(0)>126))return null;return[...s].map(c=>/[A-Za-z0-9._~-]/.test(c)?c:'%'+c.charCodeAt(0).toString(16).toUpperCase().padStart(2,'0')).join('')}\n const d=new Map<string,[bigint,string]>(),seen=new Set<string>();for(const r of s.split(';')){const at=r.indexOf('='),left=r.slice(0,at),val=r.slice(at+1),q=left.split(':');if(at<0||q.length!==2||!/^(?:0|[1-9]\\d*)$/.test(q[0])||BigInt(q[0])>9223372036854775807n||!/^[a-z][a-z0-9]*(?:-[a-z0-9]+)*$/.test(q[1])||seen.has(left))return null;seen.add(left);const v=BigInt(q[0]),old=d.get(q[1]);if(!old||v>old[0])d.set(q[1],[v,val])}return[...d].sort(([a],[b])=>a<b?-1:a>b?1:0).map(([k,[v,value]])=>k+'='+value+'@'+v).join(';')\n }catch{return null}}\n\nexport function escapedFieldParser(input:string):string|null{return run(input,1)}\n",
      "label": "author-reference",
      "sha256": "10a79de54698fbd7e9119c5927aac57754248efd7caad6e647db37ec6eb47948"
    }
  }
}
